[
 {
  "name": "endsWith",
  "type": "op",
  "ret": 1,
  "param": "",
  "input": "",
  "spec": "06-operators.md#endswith"
 },
 {
  "type": "op",
  "ret": 0,
  "name": "endsWith",
  "param": "TestCase",
  "input": "",
  "spec": "06-operators.md#endswith"
 },
 {
  "input": "TestCase",
  "param": "",
  "type": "op",
  "ret": 1,
  "name": "endsWith",
  "spec": "06-operators.md#endswith"
 },
 {
  "input": "abcdefghi",
  "param": "abc",
  "ret": 0,
  "type": "op",
  "name": "endsWith",
  "spec": "06-operators.md#endswith"
 },
 {
  "input": "abcdefghi",
  "param": "def",
  "type": "op",
  "ret": 0,
  "name": "endsWith",
  "spec": "06-operators.md#endswith"
 },
 {
  "input": "abcdefghi",
  "param": "ghi",
  "name": "endsWith",
  "type": "op",
  "ret": 1,
  "spec": "06-operators.md#endswith"
 },
 {
  "input": "abcdef\u0000ghi",
  "param": "ghi",
  "type": "op",
  "ret": 1,
  "name": "endsWith",
  "spec": "06-operators.md#endswith"
 }
]
