[
 {
  "type": "tfn",
  "name": "uppercase",
  "input": "",
  "output": "",
  "ret": 0,
  "spec": "07-transformations.md#uppercase"
 },
 {
  "type": "tfn",
  "name": "uppercase",
  "input": "TESTCASE",
  "output": "TESTCASE",
  "ret": 0,
  "spec": "07-transformations.md#uppercase"
 },
 {
  "type": "tfn",
  "name": "uppercase",
  "input": "testcase",
  "output": "TESTCASE",
  "ret": 1,
  "spec": "07-transformations.md#uppercase"
 },
 {
  "type": "tfn",
  "name": "uppercase",
  "input": "Test\u0000Case 1",
  "output": "TEST\u0000CASE 1",
  "ret": 1,
  "spec": "07-transformations.md#uppercase"
 }
]
