[
 {
  "input": "",
  "param": "",
  "name": "beginsWith",
  "type": "op",
  "ret": 1,
  "spec": "06-operators.md#beginswith"
 },
 {
  "param": "TestCase",
  "input": "",
  "name": "beginsWith",
  "ret": 0,
  "type": "op",
  "spec": "06-operators.md#beginswith"
 },
 {
  "name": "beginsWith",
  "ret": 1,
  "type": "op",
  "param": "",
  "input": "TestCase",
  "spec": "06-operators.md#beginswith"
 },
 {
  "param": "abcdef",
  "input": "abcdef",
  "ret": 1,
  "type": "op",
  "name": "beginsWith",
  "spec": "06-operators.md#beginswith"
 },
 {
  "param": "abcdef",
  "input": "abcdefghi",
  "ret": 1,
  "type": "op",
  "name": "beginsWith",
  "spec": "06-operators.md#beginswith"
 },
 {
  "name": "beginsWith",
  "type": "op",
  "ret": 0,
  "param": "abcdef",
  "input": "abc",
  "spec": "06-operators.md#beginswith"
 }
]
