[
 {
  "ret": 0,
  "input": "",
  "type": "tfn",
  "name": "hexDecode",
  "output": "",
  "spec": "07-transformations.md#hexdecode"
 },
 {
  "output": "TestCase",
  "ret": 1,
  "name": "hexDecode",
  "input": "5465737443617365",
  "type": "tfn",
  "spec": "07-transformations.md#hexdecode"
 },
 {
  "type": "tfn",
  "input": "546573740043617365",
  "name": "hexDecode",
  "ret": 1,
  "output": "Test\u0000Case",
  "spec": "07-transformations.md#hexdecode"
 },
 {
  "type": "tfn",
  "name": "hexDecode",
  "input": "01234567890a0",
  "output": "\u0001#Eg\n",
  "ret": 1,
  "spec": "07-transformations.md#hexdecode"
 }
]
