[
 {
  "ret": 0,
  "input": "",
  "type": "tfn",
  "name": "base64DecodeExt",
  "output": "",
  "spec": "07-transformations.md#base64decodeext"
 },
 {
  "output": "TestCase",
  "ret": 1,
  "name": "base64DecodeExt",
  "input": "VGVzdENhc2U=",
  "type": "tfn",
  "spec": "07-transformations.md#base64decodeext"
 },
 {
  "output": "TestCase1",
  "name": "base64DecodeExt",
  "input": "VGVzdENhc2Ux",
  "type": "tfn",
  "ret": 1,
  "spec": "07-transformations.md#base64decodeext"
 },
 {
  "ret": 1,
  "input": "VGVzdENhc2UxMg==",
  "name": "base64DecodeExt",
  "type": "tfn",
  "output": "TestCase12",
  "spec": "07-transformations.md#base64decodeext"
 },
 {
  "ret": 1,
  "input": "P.HNjcmlwdD5hbGVydCgxKTwvc2NyaXB0Pg==",
  "name": "base64DecodeExt",
  "type": "tfn",
  "output": "<script>alert(1)</script>",
  "spec": "07-transformations.md#base64decodeext"
 },
 {
  "output": "Test\u0000Case",
  "input": "VGVzdABDYXNl",
  "name": "base64DecodeExt",
  "type": "tfn",
  "ret": 1,
  "spec": "07-transformations.md#base64decodeext"
 }
]
