[
 {
  "output": "",
  "input": "",
  "type": "tfn",
  "name": "replaceComments",
  "ret": 0,
  "spec": "07-transformations.md#replacecomments"
 },
 {
  "input": "TestCase",
  "type": "tfn",
  "name": "replaceComments",
  "ret": 0,
  "output": "TestCase",
  "spec": "07-transformations.md#replacecomments"
 },
 {
  "ret": 0,
  "input": "Test\u0000Case",
  "name": "replaceComments",
  "type": "tfn",
  "output": "Test\u0000Case",
  "spec": "07-transformations.md#replacecomments"
 },
 {
  "ret": 1,
  "input": "/* TestCase */",
  "name": "replaceComments",
  "type": "tfn",
  "output": " ",
  "spec": "07-transformations.md#replacecomments"
 },
 {
  "output": " ",
  "ret": 1,
  "type": "tfn",
  "input": "/*TestCase*/",
  "name": "replaceComments",
  "spec": "07-transformations.md#replacecomments"
 },
 {
  "input": "/* TestCase*/",
  "type": "tfn",
  "name": "replaceComments",
  "ret": 1,
  "output": " ",
  "spec": "07-transformations.md#replacecomments"
 },
 {
  "output": " ",
  "ret": 1,
  "name": "replaceComments",
  "input": "/*TestCase */",
  "type": "tfn",
  "spec": "07-transformations.md#replacecomments"
 },
 {
  "output": "Before After",
  "ret": 1,
  "type": "tfn",
  "input": "Before/* TestCase */After",
  "name": "replaceComments",
  "spec": "07-transformations.md#replacecomments"
 },
 {
  "output": "Before   After",
  "name": "replaceComments",
  "input": "Before /* TestCase */ After",
  "type": "tfn",
  "ret": 1,
  "spec": "07-transformations.md#replacecomments"
 },
 {
  "type": "tfn",
  "input": "/* Test\nCase */",
  "name": "replaceComments",
  "ret": 1,
  "output": " ",
  "spec": "07-transformations.md#replacecomments"
 },
 {
  "name": "replaceComments",
  "input": "/* Test\r\nCase */",
  "type": "tfn",
  "ret": 1,
  "output": " ",
  "spec": "07-transformations.md#replacecomments"
 },
 {
  "ret": 1,
  "input": "/* Test\nCase */",
  "type": "tfn",
  "name": "replaceComments",
  "output": " ",
  "spec": "07-transformations.md#replacecomments"
 },
 {
  "ret": 1,
  "name": "replaceComments",
  "input": "/* Test\rCase */",
  "type": "tfn",
  "output": " ",
  "spec": "07-transformations.md#replacecomments"
 },
 {
  "ret": 1,
  "input": "Before/* Test\r\nCase ",
  "type": "tfn",
  "name": "replaceComments",
  "output": "Before ",
  "spec": "07-transformations.md#replacecomments"
 },
 {
  "output": "Before  ",
  "input": "Before /* Test\nCase ",
  "type": "tfn",
  "name": "replaceComments",
  "ret": 1,
  "spec": "07-transformations.md#replacecomments"
 },
 {
  "output": "Before ",
  "ret": 1,
  "input": "Before/* Test\r\nCase ",
  "name": "replaceComments",
  "type": "tfn",
  "spec": "07-transformations.md#replacecomments"
 },
 {
  "input": "Before /* Test\nCase ",
  "name": "replaceComments",
  "type": "tfn",
  "ret": 1,
  "output": "Before  ",
  "spec": "07-transformations.md#replacecomments"
 },
 {
  "ret": 0,
  "name": "replaceComments",
  "input": "Test\r\nCase */After",
  "type": "tfn",
  "output": "Test\r\nCase */After",
  "spec": "07-transformations.md#replacecomments"
 },
 {
  "output": "Test\nCase */ After",
  "name": "replaceComments",
  "input": "Test\nCase */ After",
  "type": "tfn",
  "ret": 0,
  "spec": "07-transformations.md#replacecomments"
 },
 {
  "output": "Test\r\nCase */After",
  "ret": 0,
  "name": "replaceComments",
  "input": "Test\r\nCase */After",
  "type": "tfn",
  "spec": "07-transformations.md#replacecomments"
 },
 {
  "input": "Test\nCase */ After",
  "name": "replaceComments",
  "type": "tfn",
  "ret": 0,
  "output": "Test\nCase */ After",
  "spec": "07-transformations.md#replacecomments"
 }
]
