[
 {
  "param": "([0-9]{3}\\.){2}[0-9]{3}-[0-9]{2}",
  "input": "asdf 010.817.514-60 asdf",
  "ret": 1,
  "type": "op",
  "name": "verifycpf",
  "spec": "06-operators.md#verifycpf"
 },
 {
  "param": "([0-9]{3}\\.){2}[0-9]{3}-[0-9]{2}",
  "input": "asdf 010.817 asdf",
  "ret": 0,
  "type": "op",
  "name": "verifycpf",
  "spec": "06-operators.md#verifycpf"
 }
]
